question,answer,additional_info,metadata.specialty,metadata.specialty2,metadata.region,metadata.subregion,metadata.diagnosis1,metadata.diagnosis2,metadata.procedure,metadata.procedure2,metadata.procedure3,,
How is wear of the glenoid classified?,Walch Classification,Type A: Central erosion A1: minor A2: deep   Type B: Posterior subluxation of the humeral head B1: Posterior glenoid wear B2: Biconcave glenoid wear B3: Progression of biconcanve wear to >80%   Type C: >25Â° of glenoid retroversion (associated with glenoid dysplasia),shoulderelbow,,shoulder,glenoid,,,,,,,
What glenoid wear pattern is more common with rheumatoid arthritis?,Central wear,,shoulderelbow,,shoulder,,,,,,,,
What glenoid wear pattern is more common with osteoarthritis?,Posterior wear,,shoulderelbow,,shoulder,,,,,,,,
What are the contraindications (4) for Total Shoulder Arthroplasty?,1) Rotator cuff arthropathy 2) Irreparable rotator cuff tear 3) Inadequate bone stock 4) Infection,"""Rotator cuff arthropathy is a contraindication because of the """"rocking horse"""" phenomenon (risk of loosening of the glenoid prosthesis is high)""",shoulderelbow,,shoulder,,,,shoulder_arthroplasty,,,,
What is the most commonly used surgical approach for TSA?,Deltopectoral,,shoulderelbow,,shoulder,,,,shoulder_arthroplasty,,,,
The humeral head is retroverted how many degrees relative to the transepicondylar axis?,30-40Â°,,shoulderelbow,,shoulder,,,,,,,,
How much glenoid retroversion can be corrected with reaming?,15Â°,,shoulderelbow,,shoulder,,,,,,,,
"""What is the """"Rocking Horse"""" phenomenon?","Loosening of the glenoid compartment due to edge loading""",,shoulderelbow,,shoulder,,,,shoulder_arthroplasty,,,,
"""With what pathology is the """"Rocking Horse"""" phenomenon seen?","Rotator cuff insufficiency""",,shoulderelbow,,shoulder,,,,shoulder_arthroplasty,,,,
Which nerve is at risk with a retractor placed under the conjoint tendon?,Musculocutaneous,,shoulderelbow,,shoulder,,,,,,,,
What motion should be restricted in the first 6 weeks following TSA?,External rotation to protect the subscapularis tendon repair,,shoulderelbow,,shoulder,,,,shoulder_arthroplasty,,,,
What are the indications (5) for a primary RSA?,1) Rotator cuff tear arthropathy 2) Rheumatoid arthritis 3) Failed TSA 4) 3 and 4-part proximal humerus fractures in the elderly 5) B2 glenoid osteoarthritis in the elderly,,shoulderelbow,,shoulder,,,,reverse_shoulder_arthroplasty,,,,
Where should the glenosphere be placed in a Grammont style RSA?,As inferiorly on the glenoid as possible with inferior tilt,,shoulderelbow,,shoulder,,,,reverse_shoulder_arthroplasty,,,,
"For reverse shoulder replacements, what is the most common complication that occurs if the glenosphere is malpositioned superiorly?",Scapular notching,,shoulderelbow,,shoulder,,,,reverse_shoulder_arthroplasty,,,,
What is the classification for scapular notching?,Sirveaux Classification,Grade I: Notching to scapular pillar Grade II: Notching to the inferior screw of the baseplate Grade III: Notching beyond the inferior screw of the baseplate Grade IV: Notching to the central peg of the baseplate,shoulderelbow,,shoulder,,,,,,,,
What fracture must be ruled out after a fall in a patient with a RSA?,Acromion fracture,,shoulderelbow,,shoulder,,,,reverse_shoulder_arthroplasty,,,,
The radial nerve can be found between what two muscles on the anterolateral arm?,Brachialis Brachioradialis,,hand,,forearm,,,,,,,,
What are the two terminal branches of the radial nerve?,Superficial Radial Nerve Posterior Interosseous Nerve (PIN),,hand,,forearm,,,,,,,,
Where does the radial nerve division occur?,At the level of the radial head,,hand,,elbow,,,,,,,,
"Following a radial nerve injury, what is the last muscle to regain function?",Extensor indicis proprius (EIP),,hand,,forearm,,radial_n_palsy,,,,,,
What is the innervation (2) of the brachialis muscle?,Lateral 1/3 - Radial nerve Medial 2/3 - Musculocutaneous nerve,,shoulderelbow,,shoulder,,,,,,,,
What is the terminal branch of the musculocutaneous nerve?,Lateral antebrachial cutaneous nerve,,hand,,forearm,,,,,,,,
At what level does the ulnar nerve travel from the anterior to posterior compartment?,Arcade of Struthers,8 cm proximal to the medial epicondyle,hand,,shoulder,,,,,,,,
What are the 3 heads of the triceps muscle?,Lateral Long Medial,,sports,,shoulder,,,,,,,,
Where does the long head of the triceps originate?,Inferior glenoid tubercle,,shoulderelbow,,shoulder,,,,,,,,
What is the classification for single column distal humerus fractures?,Milch,Type I: Lateral trochlear ridge intact Type II: Fracture through the lateral trochlear ridge,trauma,,elbow,,,,,,,,
What is the classification for two column distal humerus fractures?,Jupiter,"Descriptive: High-T, Low-T, Y, H, Lambda",trauma,,elbow,,,,,,,,
What is a Holstein-Lewis fracture?,"Spiral, distal 1/3 humerus w/ radial nerve palsy",,trauma,,elbow,,,,,,,,
What are the nonoperative indications for humeral shaft fractures?,Anterior angulation: <30Â° Varus/valgus angulation: <20Â° Shortening: <3 cm,,trauma,,arm,humeral_shaft,humeral_shaft_fx,,,,,,
What type of splint is initially used for midshaft humerus fractures?,Coaptation splint,,trauma,,arm,humeral_shaft,humeral_shaft_fx,,,,,,
What type of mold should be placed on a coaptation splint?,Valgus mold,Counters varus displacement,trauma,,arm,humeral_shaft,humeral_shaft_fx,,,,,,
What brace can be used for nonoperative treatment of a humeral shaft fracture?,Functional (Sarmiento) brace,,trauma,,arm,humeral_shaft,humeral_shaft_fx,,,,,,
How does a functional brace work?,Hydrostatic pressure maintains reduction,,trauma,,arm,humeral_shaft,humeral_shaft_fx,,,,,,
Is a radial nerve palsy a contraindication to functional bracing?,No,,trauma,,arm,humeral_shaft,humeral_shaft_fx,,,,,,
"With humeral nailing, which nerve is at risk when placing a distal anterior to posterior screw?",Musculocutaneous nerve,,trauma,,arm,humeral_shaft,humeral_shaft_fx,,humeral_nailing,,,,
"With humeral nailing, which nerve is at risk when placing a distal lateral to medial screw?",Radial nerve,,trauma,,arm,humeral_shaft,humeral_shaft_fx,,humeral_nailing,,,,
"What are the treatment options (3) for a comminuted distal humerus fracture in an elderly, low demand patient?",Nonoperative ORIF Total Elbow Arthroplasty,Comminuted means broken into several pieces,trauma,,elbow,distal_humerus,distal_humerus_fx,,distal_humerus_orif,,,,
What fracture is a relative contraindication to TEA?,Olecranon fracture,,trauma,,elbow,olecranon,olecranon_fx,,total_elbow_arthroplasty,,,,
Are there any permanent postoperative restrictions following TEA?,Refrain from repetitive lifting >5 pounds,,trauma,,elbow,,,,total_elbow_arthroplasty,,,,
What distal humerus approach allows for direct visualization of the joint surface?,Posterior approach with an olecranon osteotomy,,trauma,,shoulder,distal_humerus,distal_humerus_fx,,distal_humerus_orif,,,,
What is the shape of the olecranon osteotomy?,Distal chevron,,trauma,,elbow,,,,,,,,
What is the functional range of motion of the elbow?,30Â°-130Â° of flexion 50Â° of both supination and pronation,,shoulderelbow,,elbow,,,,,,,,
What is the normal carrying angle of the elbow?,10-15Â° of valgus,,shoulderelbow,,elbow,,,,,,,,
The capsule of the elbow is maximally distended at what degree of flexion?,75Â°,,shoulderelbow,,elbow,,,,,,,,
"""What structures (3) create the borders of the """"soft spot"""" on the lateral aspect of the elbow?","Olecranon Lateral epicondyle Radial head""",,shoulderelbow,,elbow,,,,,,,,
What muscles (5) originate on the medial epicondyle?,Pronator teres Flexor carpi radialis Palmaris longus Flexor digitorum superficialis Flexor carpi ulnaris,,hand,,elbow,,,,,,,,
What muscles (5) originate on the lateral epicondyle?,Anconeus Extensor carpi radialis brevis Extensor carpi radialis longus Extensor carpi ulnaris  Extensor digitorum,,hand,,elbow,,,,,,,,
Where does the medial collateral ligament of the elbow insert?,Sublime tubercle,,shoulderelbow,,elbow,,,,,,,,
Is the MCL tighter in pronation or supination?,Pronation,,sports,,elbow,,,,,,,,
What are the bundles (3) of the MUCL?,Anterior Posterior Transverse,,sports,,elbow,,,,,,,,
Which bundle of the MUCL is the primary restraint to valgus motion?,Anterior,,sports,,elbow,,,,,,,,
What 4 structures make up the lateral collateral ligament complex?,Accessory LCL Annular ligament  Lateral radial collateral ligament (LRCL)  Lateral ulnar collateral ligament (LUCL),,shoulderelbow,,elbow,,,,,,,,
Where does the LUCL insert?,Supinator Crest,,sports,,elbow,,,,,,,,
Is the LUCL tigher in pronation or supination?,Supination,,sports,,elbow,,,,,,,,
What is the primary stabilizer to varus and external rotation stress of the elbow?,LUCL,,sports,,elbow,,,,,,,,
What structure is at risk with dissection distal to the annular ligament?,Posterior interosseous nerve (PIN),,hand,,elbow,,,,,,,,
What is the interval for the Kaplan approach?,ED and ECRB,,hand,,elbow,,,,,,,,
What is the interval for the Kocher approach of the forearm?,ECU and Anconeus,,hand,,elbow,,,,,,,,
What nerve is at greatest risk with the Kaplan and Kocher approaches?,PIN,,hand,,elbow,,,,,,,,
How should the forearm be positioned to minimize risk to the PIN during the Kaplan or Kocher approach?,Pronated,,shoulderelbow,hand,elbow,,,,,,,,
What are the five entrapment sites of the ulnar nerve about the elbow?,Arcade of Struthers Medial head of triceps Medial intermuscular septum Osbourne's ligament Two heads of the FCU,,hand,,elbow,,ulnar_n_compression,,,,,,
What is the most common site for medial nerve entrapment about the elbow?,Between two heads of the pronator teres,,hand,,elbow,,medial_n_compression,,,,,,
What cutaneous nerve is commonly encountered during a cubital tunnel release?,Medial antebrachial cutaneous nerve,,hand,,elbow,,,,cubital_tunnel_release,,,,
What are the first two branches of the ulnar nerve after it passes into the posterior compartment?,First branch: Articular branch Second branch: Nerve to FCU,,hand,,elbow,,,,,,,,
Which nerve is at risk when placing the proximal anterolateral portal for elbow arthroscopy?,Radial nerve,,sports,,elbow,,,,elbow_arthroscopy,,,,
Which nerve is at risk when placing the distal anterolateral portal for elbow arthroscopy?,Lateral antebrachial cutaneous,,sports,,elbow,,,,elbow_arthroscopy,,,,
Which nerve is at risk when placing the proximal anteromedial portal for elbow arthroscopy?,Medial antebrachial cutaneous nerve,,sports,,elbow,,,,elbow_arthroscopy,,,,
What is the primary function of the long head of the biceps?,Supination,,sports,,elbow,,,,,,,,
Where on the radial tuberosity does the biceps tendon insert?,Ulnar aspect,,hand,,elbow,,,,,,,,
Which head of the biceps inserts more proximally on the radial tuberosity?,Long head,,sports,,elbow,,,,,,,,
What is the interval for a distal biceps repair?,Pronator Teres (Median nerve) Brachioradialis (Radial nerve),,shoulderelbow,,elbow,,distal_biceps_tear,,distal_biceps_repair,,,,
What are the five entrapment sites of the median nerve about the elbow?,Supracondylar process Ligament of struthers Bicipital aponeurosis Two heads of the pronator teres FDS,,hand,,elbow,,,,,,,,
What is the most common site for ulnar nerve entrapment?,Between the two heads of the FCU,,hand,,elbow,,,,,,,,
"What physical exam finding is present with ulnar nerve compression about the elbow, but NOT present with compression distally in Guyon's canal?",Sensory deficits over the dorsal lateral hand,,hand,,elbow,,ulnar_n_compression,,,,,,
What are the five entrapment sites of the radial nerve about the elbow?,Arcade of Froshe Distal aspect of the supinator muscle ECRB  Fibrous bands around the radial head Leash of Henry,,hand,,elbow,,radial_n_compression,,,,,,
What is the most common site for radial nerve entrapment about the elbow?,Arcade of Froshe,,hand,,elbow,,radial_n_compression,,,,,,
Where is the Arcade of Froshe located?,Proximal edge of the supinator muscle,,hand,,elbow,,,,,,,,
What is the classification for capitellum fractures?,Bryan and Morrey Classification,Type I: Large osseous piece   Type II: Shear fracture of articular surface (Kocher-Lorenz)   Type III: Comminuted (Broberg-Morrey)   Type IV: Coronal shear of capitellum and trochlea,trauma,,elbow,,capitellum_fx,,,,,,
What is the most common complication following ORIF of fractures about the elbow?,Elbow stiffness,,trauma,,elbow,,,,orif,,,,
What are the two classifications for coronoid fractures?,Regan Morrey O'Driscoll,"Regan Morrey -Type 1: Coronoid tip fractures -Type 2: Fracture involving <50% of coronoid height -Type 3: Fracture involving >50% of coronoid height   O'Driscoll: Descriptive of fracture location and number of fracture fragments -Tip, anteromedial facet, basal",trauma,,elbow,,coronoid_fx,,,,,,
What injury should be considered with a coronoid fracture?,Elbow dislocation,,trauma,,elbow,,coronoid_fx,,,,,,
What is a Monteggia fracture?,Proximal 1/3 Ulna Fracture + Radial Head Dislocation,,trauma,,elbow,,monteggia_fx,,,,,,
What is the classification for Monteggia fractures?,Bado Classification,Type 1: Anterior radial head dislocation and apex anterior proximal ulna fracture   Type 2: Posterior radial head dislocation and apex posterior proximal ulna fracture   Type 3: Lateral radial head dislocation and apex lateral proximal ulna fracture   Type 4: Fractures of the proximal radius and ulna with radial head dislocation,trauma,,elbow,,monteggia_fx,,,,,,
Which nerve is most at risk with a Monteggia fracture?,PIN,,trauma,,elbow,,monteggia_fx,,,,,,
What commonly leads to continued radial head dislocation following ulnar fixation in a Monteggia fracture?,Malreduction of the ulna,,trauma,,elbow,,monteggia_fx,,,,,,
What is the classification for radial head fractures?,Mason Classification,Type 1: <2 mm displacement    Type 2: >2 mm displacement   Type 3: Comminuted   Type 4: Radial head fracture with an elbow dislocation,trauma,,elbow,,radial_head_fx,,,,,,
Interposition of what structure may lead to an irreducible radiocapitellar joint?,Annular ligament,,trauma,,elbow,,,,,,,,
What quadrant of the radial head is most vulnerable to fracture?,Anterolateral,,trauma,,elbow,,,,,,,,
What are the surgical treatment options (3) for radial head fractures?,ORIF Replacement Excision,,trauma,,elbow,,radial_head_fx,,orif,,,,
Where is the non-articular portion of the radial head located?,90Â° arc from Listers tubercle to the radial styloid,,trauma,,elbow,,,,,,,,
Why is the non-articular portion of the radial head important?,Safe zone for hardware placement,,trauma,,elbow,,,,radial_head_orif,,,,
What is the terrible triad of the elbow?,Coronoid fracture Radial head fracture Elbow dislocation,,sports,,elbow,,terrible_triad,,,,,,
What is the circle of Hori?,The ligaments of the elbow from lateral to medial LUCL --> Capsule --> MUCL,,sports,,elbow,,,,,,,,
Where do elbow LCL injuries most commonly occur?,Proximally as avulsions off the lateral epicondyle,,sports,,elbow,,LCL_tear_elbow,,,,,,
Injury to the LUCL leads to what type of elbow instability?,Posterolateral rotatory instability,"*Caused by an axial load, valgus force, and supination (external rotation) moment about the forearm",sports,,elbow,,LCL_tear_elbow,,,,,,
Fracture of what percentage of the coronoid may result in instability?,>50%,Type III - >50% of coronoid fractured (needs ORIF),sports,,elbow,,coronoid_fx,,orif,,,,
What type of instability is associated with an anteromedial coronoid fracture AND LCL injury?,Varus posteromedial rotatory instability,,sports,,knee,,coronoid_fx,LCL_tear_elbow,,,,,
What stabilizes the proximal radioulnar joint?,Annular ligament,,sports,,elbow,,,,,,,,
In which direction does the elbow most commonly dislocate?,Posterolateral,,sports,,elbow,,elbow_dislocation,,,,,,
What is the difference between a simple and a complex elbow dislocation?,Simple dislocations occur without fractures,,sports,,elbow,,elbow_dislocation,,,,,,
What is the eponym for medial epicondylitis?,Golfer's elbow,,sports,,elbow,,medial_epicondylitis,,,,,,
What clinical examination test assesses for medial epicondylitis?,"Supinate arm, flex wrist",,sports,,elbow,,medial_epicondylitis,,,,,,
What is the eponym for lateral epicondylitis?,Tennis elbow,,sports,,elbow,,lateral_epiconylitis,,,,,,
Which tendon is most commonly involved in lateral epicondylitis?,ECRB tendon,,sports,,elbow,,lateral_epiconylitis,,,,,,
What histologic finding is seen with lateral epicondylitis?,Angiofibroblastic dysplasia,"With tendinopathy, normal tendon fibers are invaded by fibroblasts and atypical vascular granulation tissue, and the adjacent tissue becomes degenerative, hypercellular, and microfragmented.",sports,,elbow,,lateral_epiconylitis,,,,,,
What clinical examination test assesses for lateral epicondylitis?,Resisted wrist extension,,sports,,elbow,,lateral_epiconylitis,,,,,,
Partial distal biceps tendon tears occur on what side of the radial tuberosity?,Radial side,,sports,,elbow,,distal_biceps_tear,,,,,,
What type of muscular contraction commonly leads to distal biceps rupture?,Eccentric contraction,,sports,,elbow,,distal_biceps_tear,,,,,,
What deformity may occur following a distal bicep tendon rupture?,Reverse Popeye deformity,,sports,,elbow,,distal_biceps_tear,,,,,,
What is the hook test?,Hooking the lateral edge of the bicep tendon with the elbow flexed to 90Â° and supinated,No hooking of cord = no intact distal biceps tendon,sports,,elbow,,distal_biceps_tear,,,,,,
What structure may give a false positive hook test if performed medial to lateral?,Lacertus fibrosis,,sports,,elbow,,distal_biceps_tear,,,,,,
What is the first nerve at risk during the approach to repair a distal biceps tendon rupture?,Lateral antebrachial cutaneous nerve,"*In terms of arterial issues, watch out for the recurrent radial artery when dissecting *Most commonly injured *motor* nerve = PIN",sports,,elbow,,distal_biceps_tear,,,,,,
What complications are more common with single and double distal biceps incision repairs?,Single incision: Synostosis Double incision: Heterotopic ossification,,sports,,elbow,,distal_biceps_tear,,distal_biceps_repair,,,,
What are the five ligaments of the interosseous membrane of the forearm?,Proximal oblique cord Dorsal oblique accessory cord Central band Accessory band Distal oblique bundle,,hand,,forearm,,,,,,,started anatomy,
Which ligament of the interosseous membrane is most important for stability?,Central band,Second principle stabilizer of the radius,hand,,forearm,,,,,,,,
What is the relationship of the bicipital tuberosity and the radial styloid on an AP radiograph?,180Â°,,hand,,forearm,,,,,,,,
What is the relationship of the coronoid and the ulnar styloid on a lateral radiograph?,180Â°,,hand,,forearm,,,,,,,,
What is the most distal muscle belly on the extensor side of the forearm?,Extensor indicis proprius,,hand,,forearm,,,,,,,,
What are the components (6) of the triangular fibrocartilage complex (TFCC)?,Meniscal homologue Articular disc Ulnolunate and Ulnotriquetral ligaments ECU subsheath Radioulnar ligaments - volar and dorsal,Remember - Dr. MAUER,hand,,wrist,TFCC,,,,,,,
Which ligaments of the TFCC are the primary stabilizers?,Radioulnar ligaments - volar and dorsal,*The TFCC is a key stabilizer of the DRUJ,hand,,wrist,TFCC,,,,,,,
In which positions are the radioulnar ligaments of the DRUJ most stable?,Dorsal radioulnar ligaments: Supination Volar radioulnar ligaments: Pronation,,hand,,wrist,DRUJ,,,,,,,
Which nerve innervates the wrist capsule?,PIN,,hand,,wrist,,,,,,,,
Which tendon is found directly ulnar to Listler's tubercle?,EPL,,hand,,wrist,,,,,,,,
What are the contents of the extensor compartments of the wrist?,1 - EPB and APL 2 - ECRB and ECRL 3 - EPL 4 - ED and EI 5 - EDM 6 - ECU,,hand,,wrist,,,,,,,,
Which 1st extensor compartment tendon has more variable anatomy (EPB or APL)?,APL,May have multiple slips,hand,,wrist,,,,,,,,
What condition is associated with the first extensor compartment?,Dequervain's tenosynovitis,,hand,,forearm,,dequervains_tenosynovitis,,,,,,
What condition is associated with the second extensor compertment?,Intersection syndrome,,hand,,forearm,,intersection_syndrome,,,,,,
What is the most common dorsal approach to the distal radius?,Incise the 3rd extensor compartment w/ elevation of the radial aspect of the 4th extensor compartment,,hand,,forearm,,,,,,,,
What are the branches (3) of the median nerve at the level of the wrist?,Median nerve proper Palmar cutaneous branch Recurrent motor branch,,hand,,forearm,,,,,,,,
The palmar cutaneous branch of the median nerve gives sensation to which part of the hand?,Thenar eminence,,hand,,forearm,,,,,,,,
How much of the weight-bearing force is transmitted through the distal radius and ulna?,Distal radius: 80% Distal ulna: 20%,,hand,,forearm,,,,,,,,
How much of the weight-bearing force is transmitted through the proximal radius and ulna?,Proximal radius: 60% Proximal ulna: 40%,,hand,,forearm,,,,,,,,
Why does the weight-bearing force for the proximal radius and ulna differ from the distal distributions?,Inerosseous membrane distributes more force to ulna proximally,,hand,,forearm,,,,,,,,
What is the most commonly used surgical approach to the distal radius?,Volar Henry and its modifications (FCR approach),,hand,,forearm,,,,,,,,
Which nerve is located under the ulnar border of the FCR sheath?,Palmar cutaneous branch of the median nerve,,hand,,forearm,,,,,,,,
What is the name of the most common dorsal approach used for middle and proximal 1/3 radius fractures?,Dorsal Thompson,,hand,,forearm,,,,,,,,
What are the proximal and distal intervals for the Dorsal Thompson approach?,Proximally: EDC and ECRB Distally: ECRB and EPL,,hand,,forearm,,,,,,,,
Which nerve is at risk in the proximal portion of the Dorsal Thompson approach?,PIN as it traverses the supinator,,hand,,forearm,,,,,,,,
What are the (6) operative indications for forearm fractures?,Proximal 1/3 ulna fractures Displaced distal 2/3 ulna fractures Displaced radius fractures Fractures causing a loss of the radial bow Both bone forearm fractures Open fractures,,hand,,forearm,,forearm_fx,,forearm_fx_orif,,,,
What are the (3) eponyms for a fracture of the distal radius with an associated DRUJ (distal radial ulnar joint) injury?,Galeazzi fracture Fracture of necessity Piedmont fracture,These terms can be used interchangably,hand,,forearm,,distal_radius_fx,,,,,,
Post-operative forearm function depends on restoration of what during ORIF?,Radial bow,,hand,,forearm,,forearm_fx,,forearm_fx_orif,,,,
The radial head should align with the capitellum on which x-ray views?,All views :),,hand,,elbow,,,,,,,,
What complication may occur following ORIF of a both bone forearm fracture through a single incision?,Synostosis,,hand,,forearm,,both_bone_fx,,forearm_fx_orif,,,,
What is the normal radial height in wrist films?,11 mm,This is a standard radiographic parameter for wrist films.,hand,,wrist,,,,,,,,
Why should a forearm x-ray be obtained in the setting of wrist pain following trauma?,To evaluate for an Essex-Lopresti injury pattern,,hand,,forearm,,,,,,,,
What is an Essex-Lopresti fracture?,Fracture of the radial head Disruption of the DRUJ Central band of the interosseous membrane disruption,,hand,,elbow,,essex-lopresti_fx,,,,,,
What may occur in an unrecognized Essex-Lopresti fracture?,Proximal migration of the radius,,hand,,forearm,,essex-lopresti_fx,,,,,,
What neuropathy is associated with a DRUJ injury?,Ulnar nerve neuropathy,,hand,,wrist,,DRUJ_injury,,,,,,
What clinical test is often used to evaluate for DRUJ instability?,Shuck test,,hand,,wrist,,DRUJ_injury,,,,,,
What ligaments are evaluated with the Shuck test?,Radioulnar ligaments of the TFCC,,hand,,wrist,,TFCC_injury,,,,,,
What structure may lead to an irreducible DRUJ?,Interposition of the ECU tendon,,hand,,wrist,,DRUJ_injury,,,,,,
What is the eponym for a depressed fracture of the lunate fossa?,Die-punch fracture,,hand,,hand,,die_punch_fx,lunate_fx,,,,,
What is the eponym for an isolated radial styloid fracture?,Chauffeur's fracture,,hand,,wrist,,chauffeurs_fx,distal_radius_fx,,,,,
What is the eponym for an intra-articular distal radius fracture with dislocation of the radiocarpal joint?,Barton's fracture,,hand,,wrist,,bartons_fx,distal_radius_fx,,,,,
What is the eponym for an apex volar extra-articular distal radius fracture?,Colles' fracture,,hand,,wrist,,colles_fx,distal_radius_fx,,,,,
What is the eponym for an apex dorsal extra-articular distal radius fracture?,Smith's fracture,,hand,,wrist,,smiths_fx,distal_radius_fx,,,,,
What acute neuropathy may occur with a distal radius fracture?,Acute carpal tunnel,This is a surgical emergency,hand,,wrist,,distal_radius_fx,carpal_tunnel,,,,,
What are the acceptable post-reduction parameters for treating a distal radius fracture nonoperatively?,Radial height: <5 mm of shortening Volar tilt: Dorsal angulation <5Â° or within 20Â° of contralateral side Radial inclination: <5Â° difference to contralateral Articular step-off: <2 mm,,hand,,wrist,,distal_radius_fx,,,,,,
What is the purpose of the LaFontaine criteria?,To evaluate distal radius fracture stability,"Unstable if three or more of the following are present...   1) Dorsal angulation >20Â° 2) Dorsal comminution >50%, palmar comminution, intraarticular comminution 3) Initial displacement >1 cm 4) Initial radial shortening >5 mm 5) Associated ulna fracture 6) Severe osteoporosis or age >60 years",hand,,wrist,,distal_radius_fx,,,,,,
Which nerve is at risk with the radial shaft pin of a wrist spanning external fixator?,Superficial radial nerve,,hand,,wrist,,distal_radius_fx,,wrist_external_fixation,,,,
What distal radius parameter cannot reliably be restored with utilization of a wrist spanning external fixator?,Volar tilt,,hand,,wrist,,distal_radius_fx,,wrist_external_fixation,,,,
