question,answer,additional_info,metadata.specialty,metadata.specialty2,metadata.region,metadata.subregion,metadata.diagnosis1,metadata.diagnosis2,metadata.procedure,metadata.procedure2,metadata.procedure3,,
What is the classification for spinal cord injuries?,ASIA (American Spinal Injury Association) Classification,"A: Complete injury, no motor, no sensory B: Incomplete injury, no motor, sensory preserved in sacral segments C: Incomplete injury, motor preserved, strength <3/5 D: Incomplete injury, motor preserved, strength >3/5 E: Incomplete injury, motor and sensory function normal",spine,trauma,spine,,,,,,,,
What vital signs (2) are indicative of spinal shock?,Bradycardia Hypotension,,spine,trauma,spine,,spinal_shock,,,,,,
How long does spinal shock typically last?,48 hours,,spine,trauma,spine,,spinal_shock,,,,,,
What is the bulbocavernosus reflex?,Anal sphincter contraction following squeezing of the glans penis or pulling on foley catheter,,spine,trauma,spine,,,,,,,,
What suggests resolution of spinal shock?,Return of the bulbocavernosus reflex or any reflexes distal to the injury,Bulbocavernosus reflex is typically the first to return,spine,trauma,spine,,spinal_shock,,,,,,
What aspect of a spinal cord injury cannot be completely evaluated until resolution of spinal shock?,Neurologic deficits,,spine,trauma,spine,,spinal_cord_injury,spinal_shock,,,,,
What is the most common incomplete spinal cord injury?,Central cord syndrome,,spine,trauma,spine,,spinal_cord_injury,,,,,,
What symptom pattern is suggestive of central cord syndrome?,Motor deficits worse in upper extremities compared to the lower extremities,,spine,trauma,spine,,spinal_cord_injury,central_cord_syndrome,,,,,
What injury mechanisms commonly result in central cord syndrome?,Extension type injuries,,spine,trauma,spine,,spinal_cord_injury,central_cord_syndrome,,,,,
What is Brown-Sequard syndrome?,Hemi-transection of the spinal cord,,spine,trauma,spine,,spinal_cord_injury,brown_sequard_syndrome,,,,,
What symptom pattern is suggestive of Brown-Sequard Syndrome?,"Ipsilateral: Loss of motor function, loss of proprioception and vibratory sensation Contralateral: Loss of pain and temperature below the level of injury",,spine,trauma,spine,,spinal_cord_injury,brown_sequard_syndrome,,,,,
What exam findings are suggestive of Cauda-Equina Syndrome?,"Bowel and/or bladder dysfunction, saddle anesthesia, leg pain",,spine,trauma,spine,,spinal_cord_injury,cauda_equina_syndrome,,,,,
What is the most common cause of Cauda-Equina Syndrome?,"Massive central herniated disc, usually at L5-S1",,spine,trauma,spine,,spinal_cord_injury,cauda_equina_syndrome,,,,,
What study may be performed to evaluate the spine in a patient who is unable to receive an MRI?,CT Myelogram,,spine,trauma,spine,,,,,,,,
What is cervical myelopathy?,Cervical spinal cord compression resulting in clumsiness of the hands and gait abnormalities,,spine,,spine,cervical_spine,cervical_myelopathy,,,,,,
What upper extremity symptoms (6) are commonly seen with cervical myelopathy?,Hand clumsiness Positive Hoffman's sign Finger escape sign Sustained clonus Inverted radial reflex Hyperreflexia,,spine,,spine,cervical_spine,cervical_myelopathy,,,,,,
"""What is the finger escape sign?","When asked to hold the fingers extended and adducted, the small finger """"escapes"""" into abduction due to intrinsic weakness""",,spine,,spine,,,,,,,,
How is a Hoffman's test performed?,Stabilize the middle phalanx of the long finger Flick the distal phalanx into flexion allowing it to bounce back into extension Reflexive flexion of the thumb IP joint indicates a positive test,,spine,,spine,,,,,,,,
Which human leukocyte antigen (HLA) is highly associated with Ankylosing Spondylitis?,HLA-B27,,spine,,spine,,ankylosing_spondylitis,,,,,,
"""What radiographic findings are suggestive of Ankylosing Spondylitis?","Vertebral scalloping """"bamboo spine"""", marginal syndesmophytes""",,spine,,spine,,ankylosing_spondylitis,,,,,,
How do syndesmophytes differ from osteophytes?,Syndesmophytes are perpendicular to the vertebral body end plates   Osteophytes are parallel to the end plates,,spine,,spine,,,,,,,,
What additional study should be performed in a patient with Ankylosing Spondylitis and neck pain following trauma?,CT scan of cervical spine to evaluate for fracture,,spine,,spine,,ankylosing_spondylitis,,,,,,
How is Diffuse Idiopathic Skeletal Hyperostosis (DISH) defined?,Nonmarginal syndesmophytes involving 4 contiguous vertebrae,,spine,,spine,,dish,,,,,,
"""What characteristic radiographic finding is suggestive of Diffuse Idiopathic Skeletal Hyperostosis (DISH)?","""""Flowing candle wax""""""",Diffuse calcification of the anterior longitudinal ligament,spine,,spine,,dish,,,,,,
How does sacroiliac (SI) joint involvement differ between Ankylosing Spondylitis (AS) and Diffuse Idiopathic Skeletall Hyperostosis (DISH)?,AS - bilateral sacroiliitis DISH - no SI involvement,,spine,,spine,,dish,,,,,,
What nerve root lies anterior to the sacral ala?,L5,,spine,,spine,,,,,,,,
What artery crosses the SI joint anteriorly?,Superior gluteal artery,,trauma,,pelvis,,,,,,,,
"Following pelvic ring injuries, is venous or arterial intrapelvic bleeding more common?",Venous,Venous - 80% Arterial - 20%,trauma,,pelvis,,,,,,,,
"If arterial bleeding occurs following pelvic ring injury, what is the most common source?",Superior gluteal artery,,trauma,,pelvis,,,,,,,,
What muscles (6) attach to the iliac crest?,Tensor fascia latae Gluteus medius Iliacus Latissimus dorsi Abdominal muscles Erector spinae muscles,,trauma,,pelvis,,,,,,,,
What structures (2) exit the greater sciatic notch above the piriformis?,Superior gluteal vessels and nerve,,trauma,recon,pelvis,,,,,,,,
What structures (4) traverse the lesser sciatic notch?,Obturator internus tendon Nerve to obturator internus Pudendal nerve Internal pudendal artery,,trauma,recon,pelvis,,,,,,,,
What is the corona mortis?,Vascular anastomosis between the External Iliac (epigastric) and Obturator (Internal iliac) vessels,Remember: Vowels (A. E. I. O. U),trauma,,pelvis,,,,,,,,
"On average, the corona mortis is how far posterolateral to the pubic symphysis?",6.8 cm,,trauma,,pelvis,,,,,,,,
What are the windows of the ilioinguinal approach?,Medial window - medial to external iliac vessels Middle window - between external iliac vessels and iliopsoas Lateral window - lateral to iliopsoas,,trauma,,pelvis,,,,,,,,
Through which window is the corona mortis encountered?,Medial window,,trauma,,pelvis,,,,,,,,
What is the most commonly injured structure during the ilioinguinal approach?,Lateral femoral cutaneous nerve,,trauma,,pelvis,,,,,,,,
What is the Space of Retzius?,Space posterior to the pubic symphysis and anterior to the bladder,,trauma,,pelvis,,,,,,,,
The sacrospinous ligaments resist what motion?,External Rotation,,spine,,spine,,,,,,,,
The sacrotuberous ligaments resist what motion?,Vertical shear,,spine,,spine,,,,,,,,
Which ligament complex is most important for pelvic ring stability?,Posterior sacroiliac complex,,trauma,,pelvis,,,,,,,,
What are the two (2) classification systems for pelvic ring injuries?,Young-Burgess Classification Tile Classification,,trauma,,pelvis,pelvic_ring,pelvic_ring_fx,,,,,,
What are the three (3) subtypes of pelvic ring fractures according to the Young-Burgess Classification?,APC (Anterior Posterior Compression) LC (Lateral Compression) VS (Vertical Shear),"APC I: 2.5 cm pubic symphysis diastasis II: >2.5 cm pubic symphysis diastasis, sacrotuberous and sacrospinous ligaments disrupted, anterior SI ligaments disrupted (Posterior SI ligaments intact, rotationally unstable) III: APC II + Posterior SI ligament disruption (Rotationally unstable)   LC I: Pubic symphysis fracture + SI compression fracture II: LC I + iliac wing fracture (Crescent fracture) III: LC II + contralateral APC III (Windswept pelvis)",trauma,,pelvis,pelvic_ring,pelvic_ring_fx,,,,,,
What is the Tile Classification for pelvic ring fractures?,"A - Rotationally and vertically stable B - Rotationally unstable, vertically stable C - Rotationally and vertically unstable",,trauma,,pelvis,pelvic_ring,pelvic_ring_fx,,,,,,
What is the most common cause of death following an Anterior Posterior Compression (APC) pelvic ring fracture?,Hemorrhage,,trauma,,pelvis,pelvic_ring,pelvic_ring_fx,,,,,,
What is the most common cause of death following an Lateral Compression (LC) pelvic ring fracture?,Traumatic brain injury (TBI),,trauma,,pelvis,pelvic_ring,pelvic_ring_fx,,,,,,
"In the trauma bay, what is the initial treatment for a hemodynamically unstable patient with an APC pelvic injury?",Apply a pelvic binder or sheet,,trauma,,pelvis,pelvic_ring,pelvic_ring_fx,,,,,,
"For pelvic ring trauma, where should a pelvic binder or sheet be placed?",Centered over the greater trochanters,,trauma,,pelvis,pelvic_ring,pelvic_ring_fx,,,,,,
How does the use of a pelvic binder or sheet help with hemodynamic instability?,Decreases intrapelvic volume,,trauma,,pelvis,pelvic_ring,pelvic_ring_fx,,,,,,
Use of a pelvic binder or sheet is not indicated with which type of pelvic ring fracture pattern?,Lateral compression (LC),,trauma,,pelvis,pelvic_ring,pelvic_ring_fx,,,,,,
"In addition to a binder or sheet, what else may help to reduce intrapelvic volume?",Internally rotating and taping the lower extremities together,,trauma,,pelvis,pelvic_ring,pelvic_ring_fx,,,,,,
Why does an APC pelvic injury look less severe on CT-imaging than on initial radiographs?,Curve of the CT gantry under the patient internally rotates the hemipelvis,,trauma,,pelvis,pelvic_ring,pelvic_ring_fx,,,,,,
What is a Morel-Lavellee lesion?,"Closed, internal degloving injury",,trauma,,pelvis,,morel-Lavellee_lesion,,,,,,
What is the eponym for an isolated iliac wing fracture that does not extend into the SI joint?,Duverney fracture,,trauma,,pelvis,iliac_wing,duverney_fracture,,,,,,
What are the two (2) most common pin site locations for placing a pelvic external fixator?,Supra-acetabular and iliac crest,,trauma,,pelvis,,,,pelvic_external fixation,,,,
What is the classification for sacrum fractures?,Denis Classification,Zone 1: Fracture lateral to the foramina Zone 2: Fracture through the foramina Zone 3: Fracture medial to the foramina,trauma,,pelvis,,sacrum_fx,,,,,,
Which sacral fracture has the highest rate of neurologic deficit?,Denis Zone 3: Fractures medial to the foramina,,trauma,,pelvis,,sacrum_fx,,,,,,
"""What does a """"U-type"""" sacral fracture represent?","Spinopelvic dissociation""",,trauma,,pelvis,,sacrum_fx,,,,,,
What are the zones (4) of the physis?,Resting/Reserve Proliferative Hypertrophic Metaphysis,"Hypertrophic - maturation, degeneration, and zone of provisional calcification Metaphysis - primary spongiosa and secondary spongiosa",peds,,non-anatomic,,,,,,,,
Through which zone of the physis do Salter Harris fractures occur?,Hypertrophic zone (Zone of provisional calcification),,peds,,non-anatomic,,,,,,,,
What is the Groove of Ranvier?,Germinal cells that are continuous with the physis and contribute to circumferential growth,*Supplies chondrocytes to the periphery and is responsible for appositional growth of the physis,peds,,non-anatomic,,,,,,,,
What structure anchors the periphery of the physis?,Perichondrial Ring of La Croix,,peds,,non-anatomic,,,,,,,,
What is the major source of nutrition for the growth plate?,Perichondral artery,,peds,,non-anatomic,,,,,,,,
How much growth occurs per year at each physis in the lower extremity?,What is this as a percentage of lower extremity growth?   Proximal femur: 3 mm (10%) Distal femur: 9 mm (40%) Proximal tibia: 6 mm (30%) Distal tibia: 5 mm (20%),,peds,,leg,,,,,,,,
Describe the direction of closure of the proximal tibial physis?,Central to medial to lateral,,peds,,leg,,,,,,,,
Which joints have intraarticular metaphyses?,"Shoulder, Hip, Elbow, Ankle",Remember SHEA,peds,,hip,,,,,,,,
How does the blood supply to the femoral head change with age?,"Patient <4 years old: Contributions from the medial and lateral femoral circumflex arteries, and the Artery of ligamentum teres   Patient â‰Ą4 years old: Primary blood supply is the medial femoral circumflex artery",,peds,,hip,,,,,,,,
"""What is the order of ossification of the pediatric elbow?","At what age does each center ossify?    Capitellum - 1 year old Radial head - 3 years old Medial """"Internal"""" epicondyle - 5 years old Trochlea - 7 years old Olecranon - 9 years old Lateral """"External"""" epicondyle - 11 years old""","""Remember """"C-R-I-T-O-E""""""",peds,,elbow,,,,,,,,
What is the order of fusion of the pediatric elbow?,At what age does each center fuse?    Trochlea - 12 years old Lateral epicondyle - 12 years old Coronoid - 12 years old Olecranon - 15 years old Radial head - 15 years old Medial epicondyle - 17 years old,"""Remember: """"TLC OR Me""""""",peds,,elbow,,,,,,,,
Which epiphyseal centers are present at birth?,Distal Femur Proximal Tibia Calcaneus Proximal Humerus Talus Cuboid,"""Remember: """"Full Term Children Have These Centers""""""",peds,,non-anatomic,,,,,,,,
"What muscles cause avulsion fractures of the ASIS, AIIS, Ischial tuberosity and Lesser trochanter?",ASIS: Sartorius AIIS: Rectus femoris Ischial tuberosity: Hamstring Lesser trochanter: Iliopsoas,,peds,,pelvis,,avulsion_fx,,,,,,
What is the classification for fractures involving the physis?,Salter Harris Classification,"SH I: Fracture through the physis SH II: Fracture through the physis with extension into the metaphysis SH III: Fracture through the physis with extension into the epiphysis SH IV: Fracture through the metaphysis, physis, and epiphysis SH V: Physeal crush injury",peds,,non-anatomic,,physeal_fx,,,,,,
"Overall, what is the most common type of Salter Harris fracture?",SH II,,peds,,hand,,physeal_fx,,,,,,
"What is the most common SH fracture in the distal fibula, distal radius, distal tibia, and distal femur?",Distal Fibula: SH I Distal Radius: SH II Distal Tibia: SH III Distal Femur: SH IV,,peds,,leg,,physeal_fx,,,,,,
Which type of Salter Harris fracture has the highest incidence of growth arrest?,SH IV,Distal femur - 50% Distal ulna - 50%,peds,,thigh,,physeal_fx,,,,,,
What is a Thurston-Holland fragment?,Metaphyseal fragment of a SH II fracture,,peds,,forearm,,,,,,,,
What is the Risser Classification?,Measure of skeletal maturity,"Based on the ossification of the iliac apophysis. Stages start laterally and progress medially.   Stage 1: 25% of the ilium is ossified Stage 2: 50% ossified Stage 3: 75% ossified Stage 4: 100% ossified Stage 5: Fusion, apophysis to the iliac crest",peds,,pelvis,,,,,,,,
"When performing an epiphysiodesis, should you err on being too close to the epiphysis or metaphysis?",Epiphysis,Epiphysiodesis: Surgery to close the growth plate  The epiphysis is closer to the proliferative zone where the germinal centers are found,peds,,non-anatomic,,,,,,,,
"As a general rule, at what age do boys and girls stop growing in their lower extremities?",Boys: 16 years old Girls: 14 years old,,peds,,non-anatomic,,,,,,,,
What are the indications (2) for a physeal bar excision?,<50% physeal involvement â‰Ą2 years of growth remaining,Physeal bar excision: Procedure aimed to remove the fibrous or bony bar and place interposition material into the resection cavity to permit the remaining growth.,peds,,non-anatomic,,,,,,,,
What scoring system is used for generalized soft tissue laxity?,Beighton Score,Passive hyperextension of the small finger >90Â° (1 point each side) Passive abduction of the thumb to the volar forearm (1 point each side) Hyperextension of the knee >10Â° (1 point each side) Hyperextension of the elbow >10Â° (1 point each side) Palms touch the ground with forward bending at the waist while knees extended (1 point),peds,,knee,,,,,,,,
"Based on the Beighton score, what defines hypermobility?",Score â‰Ą5 out of 9,,peds,,non-anatomic,,,,,,,,
How does the physiologic alignment of the lower extremity change with age?,Salenius Curve,Birth - 1.5 years old: Genu varum 2 years old: Neutral alignment >2 years old: Genu valgum (Maximum genu valgum at 3 years of age) Adult alignment of slight valgus at 6-8 years of age,peds,,thigh,femoral shaft,,,,,,,
What are the three (3) conditions that can cause in-toeing?,Femoral anteversion Internal tibial torsion Metatarsus adductus,,peds,,hip,foot,,,,,,,
Which cause of in-toeing is most common in infants?,Toddlers? Children?   Infants: Metatarsus adductus Toddlers: Internal tibial torsions Children: Femoral anteversion,,peds,,foot,,,,,,,,
"A patient who """"W"""" sits likely has what rotational abnormality of the lower extremities?","Increased femoral anteversion""",,peds,,hip,,,,,,,,
The thigh-foot angle is used to evaluate which aspect of the lower extremity rotational profile?,Tibial torsion,,peds,,leg,tibia,,,,,,,
What is miserable malalignment syndrome?,Increased femoral anteversion and external tibial torsion,,peds,,leg,,miserable_malalignment_syndrome,,,,,,
What is Cerebral Palsy (CP)?,A nonprogressive upper motor neuron disease that occurs following injury to the developing brain,,peds,,non-anatomic,,cp,,,,,,
What classification is used to grade patient mobility in CP?,GMFCS (Gross Motor Functional Classification Scale),"Level I: Independent ambulator, almost normal motor function Level II: Walks independently, difficulty outside of the home Level III: Walks with assistance Level IV: Severely limited, wheelchair bound Level V: Nonambulatory, needs assistance with all aspect of life",peds,,non-anatomic,,cp,,,,,,
"What is the difference between quadripllegic, diplegic, and hemiplegic CP?",Quadriplegic: Total body involvement Diplegic: Lower extremities affected more than upper extremities Hemiplegic: Involves one side of the body,,peds,,non-anatomic,,,,,,,,
What is Little Leaguer's Shoulder?,Salter Harris I fracture of proximal humerus due to overuse,,peds,,shoulder,,little_leaguers_shoulder,,,,,,
What is the most common factor leading to Little Leaguer's Shoulder?,Pitch count,,peds,,shoulder,,little_leaguers_shoulder,,,,,,
What radiographic finding is suggestive of Little Leaguer's Shoulder?,Widening of the proximal humeral physis,,peds,,shoulder,,little_leaguers_shoulder,,,,,,
What is the classification for supracondylar humerus fractures?,Gartland Classification,"Type I: Nondisplaced Type II: Displaced, intact posterior periosteal hinge Type III: Completely displaced, no intact posterior hinge",peds,,elbow,distal_humerus,supracondylar_fx,,,,,,
Are flexion or extension type supracondylar humerus fractures more common?,Extension (98%),,peds,,elbow,distal_humerus,supracondylar_fx,,,,,,
What is the most common neurologic injury with extension type supracondylar humerus fractures?,AIN palsy,,peds,,elbow,distal_humerus,supracondylar_fx,,,,,,
Supracondylar humerus fractures that displace in which direction have a higher association with AIN palsies?,Posterolateral,,peds,,elbow,distal_humerus,supracondylar_fx,,,,,,
What is the second most common neurologic injury associated with extension type supracondylar humerus fractures?,Radial nerve palsy,,peds,,elbow,distal_humerus,supracondylar_fx,,,,,,
Supracondylar humerus fractures that displace in which direction have a higher association with radial nerve palsies?,Distal fragment medial,,peds,,elbow,distal_humerus,supracondylar_fx,,,,,,
What is the most common neurologic injury seen with flexion type supracondylar humerus fractures?,Ulnar nerve palsy,,peds,,elbow,distal_humerus,supracondylar_fx,,,,,,
"If you see ecchymosis anteromedially, what direction is the supracondylar humerus fracture displaced?",Posteriorlaterally,"Ecchymosis, if present, is opposite the displacement. Occurs due to stretching of the skin and soft tissues.",peds,,elbow,distal_humerus,supracondylar_fx,,,,,,
What radiographic sign might you see with a subtle Type I supracondylar humerus fracture?,Posterior fat pad sign,,peds,,elbow,distal_humerus,supracondylar_fx,,,,,,
What radiographic line should you check on the lateral radiograph when evaluating elbow injuries?,Anterior humeral line,Should intersect the middle third of the ossified capitellum in patients â‰Ą5 years old,peds,,elbow,distal_humerus,supracondylar_fx,,,,,,
What is Bauman's angle?,Measurement for coronal displacement on the AP radiograph,,peds,,elbow,distal_humerus,supracondylar_fx,,,,,,
How do you measure Bauman's angle?,Angle between a line drawn down the anatomic axis of the humerus and a line along the lateral condylar physis,Normal: 70-75,peds,,elbow,distal_humerus,supracondylar_fx,,,,,,
What is the usual treatment for a Type I supracondylar humerus fracture?,Long arm cast,,peds,,elbow,distal_humerus,supracondylar_fx,,,long_arm_cast,,,
How are type II and type III supracondylar humerus fractures typically treated?,Closed reduction and percutaneous pinning (CRPP),,peds,,elbow,distal_humerus,supracondylar_fx,,,closed_reduction_percutaneous_pinning,,,
What is a general rule of thumb for how many pins should be used for Type II and Type III supracondylar humerus fractures?,Type II - 2 pins Type III - 3 pins,,peds,,elbow,distal_humerus,supracondylar_fx,,,closed_reduction_percutaneous_pinning,,,
Which structure is at risk when placing a medial pin in the elbow?,Ulnar nerve,,peds,,elbow,distal_humerus,supracondylar_fx,,,closed_reduction_percutaneous_pinning,,,
What deformity most commonly occurs following malunion of supracondylar humerus fracture?,Cubitus Varus,This is mostly an aesthetic deformity,peds,,elbow,distal_humerus,supracondylar_fx,,,closed_reduction_percutaneous_pinning,,,
Development of cubitus varus increases the risk of which fracture in the future?,Lateral condyle fractures,,peds,,shoulder,distal_humerus,lateral_condyle_fx,,,,,,
Is the medial epicondyle an anterior or posterior structure?,Posterior,,peds,,elbow,,,,,,,,
What additional elbow injury commonly occurs in concert with medial epicondyle fractures?,Elbow dislocation,,peds,,elbow,,medial_epicondyle_fx,elbow_dislocation,,,,,
What additional x-ray views are recommended to evaluate medial epicondyle fractures?,Internal oblique and distal humerus axial views,,peds,,shoulder,,medial_epicondyle_fx,,,,,,
What are the operative indications (5) for medial epicondyle fractures?,Displacement > 5 mm Entrapment within the joint Open Ulnar nerve entrapment Gross elbow instability,,peds,,elbow,,medial_epicondyle_fx,,,,,,
What reduction maneuver can be attempted to reduce an incarcerated medial epicondyle fracture?,Roberts Maneuver,Valgus stress with forearm supination and wrist extension,peds,,elbow,,medial_epicondyle_fx,,,,,,
An olecranon apophyseal fracture in small children is pathognomonic for what condition?,Osteogenesis Imperfecta,,peds,,elbow,,olecranon_fx,osteogenesis_imperfecta,,,,,
"A reported """"elbow dislocation"""" in a child <3 years old is more likely to be what other injury?",Distal humeral physeal separation,,peds,,elbow,,distal_humeral_physeal_separation,,,,,,
In which direction do distal humeral physeal separations most commonly occur?,Posteromedial,Remember: Elbow dislocations are most commonly posterolateral,peds,,elbow,,distal_humeral_physeal_separation,,,,,,
What is the most common radial neck fracture classification in children?,O'Brien Classification,Type I: <30Â° angulation Type II: 30-60Â° angulation Type III: >60Â° angulation,peds,,elbow,,radial_neck_fx,,,,,,
What associated condition should be ruled out in the setting of radial neck fractures?,Compartment Syndrome of the volar forearm,,peds,,elbow,,radial_neck_fx,,,,,,
What complications (2) can occur following ORIF of a radial neck fracture with extensive dissection?,Radioulnar synostosis Avascular necrosis (AVN) of the radial head,,peds,,elbow,,radial_neck_fx,,radial_neck_orif,,,,
Lateral overgrowth at the elbow is a common occurance following what injury?,Lateral condyle fractures,,peds,,elbow,,lateral_condyle_fx,,,,,,
What neurologic complication can occur following lateral condyle fractures?,Tardy ulnar nerve palsy,"Tardy ulnar nerve palsy occurs as a consequence of nonunion of pediatric lateral condyle fractures at the elbow, which eventually lead to a cubitus valgus deformity. While the child grows, the deformity worsens and the ulnar nerve is gradually stretched until classic symptoms of ulnar nerve neuropathy appear.",peds,,elbow,,lateral_condyle_fx,,,,,,
What is a nursemaid's elbow?,Subluxation fo the radial head from the annular ligament,,peds,,elbow,,nursemaids_elbow,,,,,,
What is the reduction maneuver for a nursemaid's elbow?,Supination and flexion OR hyperpronation in a flexed position,,peds,,elbow,,nursemaids_elbow,,,,,,
What are the tolerances for both bone forearm fractures?,<9 years old - Angulation: <15Â° - Rotation: <45Â° - Bayonet apposition: <1 cm   >9 years old (Proximal 1/3) - Angulation: <10Â° - Rotation: 0Â°   >9 years old (Distal 2/3) - Angulation: <15Â° - Rotation: <30Â°,No bayonet apposition is acceptable >9 years old,peds,,forearm,,both_bone_fx,,,,,,
What is a greenstick fracture?,Incomplete fracture with an intact cortex,,peds,,forearm,,greenstick_fx,,,,,,
What is a buckle (torus) fracture?,Incomplete compression fracture at the junction between the cortical and metaphyseal bone,Must have two points of inflection in the cortex,peds,,forearm,,buckle_fx,,,,,,
What are some important characteristics of a good long arm cast?,3-point mold Interosseous mold Straight ulnar border Supracondylar mold Ulnar deviation,,peds,,forearm,,,,,,,,
What is a cast index?,Sagittal width of the cast divided by the coronal width of the cast,,peds,,non-anatomic,,,,,,,,
What value should the cast index be?,<0.8,Associated with a lower chance of losing reduction,peds,,non-anatomic,,,,,,,,
What is a Seymour fracture?,Open distal phalanx fracture with germinal matrix interposition,,peds,,hand,,seymour_fx,,,,,,
