question,answer,additional_info,metadata.specialty,metadata.specialty2,metadata.region,metadata.subregion,metadata.diagnosis1,metadata.diagnosis2,metadata.procedure,metadata.procedure2,metadata.procedure3,,
Which compartment is more severely diseased in a valgus knee?,Lateral compartment,,recon,,knee,,knee_oa,,,,,,
"In a valgus knee, where does most of the wear occur?",Lateral distal femoral condyle,Results in a hypoplastic lateral femoral condyle,recon,,knee,,knee_oa,,,,,,
"In a varus knee, where does most of the wear occur?",Proximal medial tibia,,recon,,knee,,knee_oa,,,,,,
What is the most common approach for a TKA?,Medial parapatellar,,recon,,knee,,,,tka,,,,
What alternative approaches (3) may be utilized for a TKA?,Subvastus Midvastus Lateral parapatellar,,recon,,knee,,,,tka,,,,
What complication is more common with use of a constrained TKA?,Aseptic loosening,"Aseptic loosening can be the result of inadequate initial fixation, mechanical loss of fixation over time, or biologic loss of fixation caused by particle-induced osteolysis around the implant.",recon,,knee,,,,tka,,,,
What is the most common complication following a TKA?,Patellar maltracking,,recon,,knee,,patellar maltracking,,tka,,,,
How may the components (3) be positioned to decrease the risk of patellar maltracking?,External rotation of the femoral and tibial components Lateralization of the femoral and tibial components Medialization of the patellar component,Note - When placing the patellar component intraoperatively the patella is everted; do not confuse with medial and lateral,recon,,knee,,patellar maltracking,,tka,,,,
Why does performing the following improve patellar tracking?,External rotation of the femoral and tibial components Lateralization of the femoral and tibial components Medialization of the patellar component   Reduces the Q-angle,,recon,,knee,,patellar maltracking,,tka,,,,
What is Whiteside's line?,A line drawn down the center of the trochlea to the top of the intercondylar notch,,recon,,knee,,,,tka,,,,
What is the transepicondylar axis?,An axis between the medial and lateral femoral epicondyles,,recon,,knee,,,,tka,,,,
What is the relationship of the transepicondylar axis to Whiteside's line?,The transepicondylar axis should be perpendicular to Whiteside's line,,recon,,knee,,,,tka,,,,
Femoral component rotation can be referenced using what three lines?,Whiteside's line Transepicondylar axis Posterior condylar axis,,recon,,knee,,,,tka,,,,
Tibial component rotation can be referenced using what two anatomic points?,Tibial tubercle Tibial crest,,recon,,knee,,,,tka,,,,
A drop rod placed in a tibial trial should line up with what anatomic structure on the foot?,Second metatarsal,,recon,,knee,,,,tka,,,,
What are the oblique cuts on the distal femur called?,Chamfer,,recon,,knee,,,,tka,,,,
"When evaluating the pieces of bone removed from the distal femur in a varus knee, should the medial or lateral piece be thicker?",Medial,Because the medial aspect of the distal femur is more distal,recon,,knee,,,,tka,,,,
"When performing the proximal tibia cut, how much bone is typically removed from the diseased side (medial side of varus knee)?",2 mm,,recon,,knee,,,,tka,,,,
"When performing the proximal tibia cut, how much bone is typically removed from the healthy side (lateral side of varus knee)?",10 mm,,recon,,knee,,,,tka,,,,
Cutting more bone from the distal femur increases which gap(s)?,Extension gap,,recon,,knee,,,,tka,,,,
Cutting more bone from the posterior femur increases which gap(s)?,Flexion gap,,recon,,knee,,,,tka,,,,
"During a TKA, cutting more bone from the proximal tibia increases which gap(s)?",Flexion and extension,,recon,,knee,,,,tka,,,,
What is the order of medial releases when performing a TKA on a varus knee?,"Deep MCL --> osteophytes --> posterior oblique ligament --> """"shift and resect"""" osteotomy --> PCL --> semimembranosus --> superficial MCL""",,recon,,knee,,,,tka,,,,
"When performing lateral releases during TKA, which structure is released if there is tightness in flexion?",Popliteus,,recon,,knee,,,,tka,,,,
"When performing lateral releases during TKA, which structures (2) are released if there is tightness in extension?",IT band and posterior capsule,,recon,,knee,,,,tka,,,,
Hypersensitivity to cobalt-chrome alloy implants is likely secondary to which metal?,Nickel,,recon,,knee,,,,,,,,
What are the two common distal femur periprosthetic fracture classifications?,Lewis and Rorabeck Classification Su Classification,Lewis and Rorabeck Type I: Nondisplaced fracture with well-fixed components Type II: Displaced fracture with well-fixed components Type III: Displaced fracture with loose components     Su Type I: Fracture proximal to the femoral component Type II: Fracture originates at the anterior flange and extends proximally Type III: Fracture extends distal to the superior aspect of the anterior flange,recon,,knee,distal_femur,distal_femur_periprosthetic_fx,,,,,,
What is the tibial periprosthetic fracture classification?,Felix Classification,Type I: Fracture of the tibial plateau Type II: Fracture around the stem Type III: Fracture distal to the stem Type IV: Fracture of the tibial tubercle,recon,,knee,proximal_tibia,proximal_tibia_periprosthetic_fx,,,,,,
What is the indication for Unicompartmental Knee Arthroplasty (UKA)?,Arthritis affecting a single compartment,,recon,,knee,,,,uka,,,,
UKA are most commonly performed for arthritis of which compartment?,Medial,,recon,,knee,,,,uka,,,,
What are the contraindications (7) for Unicompartmental Knee Arthroplasty (UKA)?,Tricompartmental arthritis ACL deficiency Rheumatoid arthritis Varus deformity >10Â° Valgus deformity >5Â° Flexion contracture Recurvatum,,recon,,knee,,,,uka,,,,
"In patients with UKA, stress fractures are most commonly seen where?",Around the tibial component,,recon,,knee,,,,uka,,,,
What is the most common cause of UKA failure?,Degeneration of the remaining compartments,,recon,,knee,,,,uka,,,,
What nerve is at risk with proximal fibula fractures?,Common peroneal nerve,,trauma,,leg,proximal_tibia,proximal_fibula_fx,,,,,,
What is Gerdy's tubercle?,Insertion site of the iliotibial band,,sports,,leg,proximal_tibia,,,,,,,
What shape is the mid-shaft of the tibia?,Triangle,,recon,,leg,tibial_shaft,,,,,,,
What structures (6) are within the anterior compartment of the leg?,Tibialis anterior Extensor digitorum longus (EDL) Extensor hallicus longus (EHL) Peroneus tertius Anterior tibial artery/vein Deep peroneal nerve,,footankle,,leg,,,,,,,,
What structures (3) are within the lateral compartment of the leg?,Peroneus longus Peroneus brevis Superficial peroneal nerve,,footankle,,leg,,,,,,,,
What structures (3) are within the posterior compartment of the leg?,Soleus Gastrocnemius Plantaris tendon,,footankle,,leg,,,,,,,,
What structures (6) are within the deep posterior compartment of the leg?,Flexor digitorum longus (FDL) Tibialis posterior Flexor hallicus longus (FHL) Posterior tibial artery and vein Tibial nerve Peroneal artery and vein,,footankle,,leg,,,,,,,,
What is the first branch of the popliteal artery?,Anterior tibial artery,,recon,,leg,,,,,,,,
What is the terminal branch of the anterior tibial artery?,Dorsalis pedis artery,,footankle,,ankle,,,,,,,,
What is the terminal branch of the peroneal artery?,Calcaneal branches,,footankle,,ankle,,,,,,,,
What are the terminal branches of the posterior tibial artery?,Medial and lateral plantar arteries,,footankle,,ankle,,,,,,,,
What are the tolerances for nonoperative management of tibial shaft fractures?,<10Â° of AP angulation <5Â° of varus/valgus angulation <1 cm of shortening <10Â° of rotational deformity >50% cortical apposition,,trauma,,leg,tibial_shaft,tibial_shaft_fx,,tibial_imn,,,,
What deformity is commonly seen with proximal third tibial shaft fractures?,Proximal fragment:  Extension - Patellar Tendon Varus - Pes Anserine   Distal fragment: Flexion - Gastrocnemius,,trauma,,leg,tibial_shaft,tibial_shaft_fx,,tibial_imn,,,,
What is the starting point for a tibial intramedullary nail (IMN) on the AP view?,Medial border of the lateral tibial spine,,trauma,,leg,tibial_shaft,tibial_shaft_fx,,tibial_imn,,,,
What is the starting point for a tibial intramedullary nail (IMN) on the lateral view?,Just anterior to the articular margin,,trauma,,leg,tibial_shaft,tibial_shaft_fx,,tibial_imn,,,,
What is the most common malunion deformity following use of an IMN for a proximal tibial fracture?,Valgus and procurvatum,,trauma,,leg,tibial_shaft,tibial_shaft_fx,,tibial_imn,,,,
"For distal tibial shaft fractures, where should blocking screws be placed to prevent valgus deformity?",Lateral to the path of the nail,Blocking nail is the pink dot below,trauma,,leg,tibial_shaft,tibial_shaft_fx,,tibial_imn,,,,
Where should blocking screws be placed to prevent procurvatum deformity?,Posteriorly to the path of the nail,Always place the blocking screw in the concavity of the deformity you are trying to prevent,trauma,,leg,tibial_shaft,tibial_shaft_fx,,tibial_imn,,,,
"What does the lateral x-ray finding of a """"dreaded black line"""" on the anterior aspect of the tibia suggest?","Stress fracture""",,trauma,,leg,tibial_shaft,tibial_shaft_stress_fx,,,,,,
Spiral distal one-third tibial shaft fractures require what additional imaging?,CT and x-rays of ankle,,trauma,,leg,distal_tibia,tibial_shaft_fx,,tibial_imn,,,,
Why are CT and x-rays of the ankle obtained with spiral distal one-third tibial shaft fractures?,To evaluate for posterior malleolus fractures,Here is an example of an isolated posterior malleolus fracture,trauma,,leg,distal_tibia,tibial_shaft_fx,,tibial_imn,,,,
What is the incidence of a posterior malleolus fracture with a spiral distal one-third tibial shaft fracture?,39%,,trauma,,leg,distal_tibia,tibial_shaft_fx,,tibial_imn,,,,
What muscles (5) are in the anterior compartment of the thigh?,Sartorius Rectus femoris Vastus lateralis Vastus intermedius Vastus medialis,,trauma,,thigh,,,,,,,,
What muscles (3) are in the posterior compartment of the thigh?,Biceps femoris Semimembranosus Semitendinosus,,trauma,,thigh,,,,,,,,
What muscles (4) are in the medial compartment of the thigh?,Gracilis Adductors longus Adductor brevis Adductor magnus,,trauma,,thigh,,,,,,,,
What is the name for the crest of bone along the posterior middle third of the femur?,Linea aspera,,trauma,,thigh,femoral shaft,,,,,,,
In which direction does the femur bow?,Anteriorly,,trauma,,thigh,femoral shaft,,,,,,,
What is the isthmus of the femur?,Narrowest part of the femoral canal,Juncture of the proximal and middle thirds,trauma,,thigh,femoral shaft,,,,,,,
What shape is the distal femur in the axial plane?,Trapezoidal,,trauma,,thigh,,,,,,,,
What muscle from the lower leg originates on the distal femur?,Gastrocnemius,,trauma,,thigh,,,,,,,,
What is the only muscle of the thigh that is innervated by the peroneal division of the sciatic nerve?,Short head of the biceps,,trauma,,thigh,femoral_shaft,,,,,,,
What is the classification for femoral shaft fractures?,Winquist Classification,Type 0: No comminution Type I: Minimal comminution Type II: >50% cortical contact Type III: <50% cortical contact Type IV: Segmental femur fracture with no cortical contact,trauma,,thigh,femoral_shaft,femoral_shaft_fx,,,,,,
The thigh can hold how much blood following a femoral shaft fracture?,1-1.5 L,,trauma,,thigh,femoral_shaft,femoral_shaft_fx,,,,,,
In which direction should a distal femoral traction pin be placed?,Medial to lateral,,trauma,,thigh,distal_femur,,,femoral_traction_pin,,,,
Why is a distal femoral traction pin placed medial to lateral?,To avoid injury to the femoral artery,,trauma,,thigh,distal_femur,,,femoral_traction_pin,,,,
Where should a distal femoral traction pin be placed?,At the level of the proximal pole of the patella and centered on the femur in the sagittal plane,,trauma,,thigh,distal_femur,,,femoral_traction_pin,,,,
"In addition to distal femur, where else may a traction pin be placed for femur fractures?",Proximal tibia,,trauma,,leg,proximal_tibia,,,tibial_traction_pin,,,,
In which direction should a proximal tibial traction pin be placed?,Lateral to medial,,trauma,,leg,proximal_tibia,,,tibial_traction_pin,,,,
Why is a proximal tibial traction pin placed lateral to medial?,To avoid injury to the common peroneal nerve,,trauma,,leg,proximal_tibia,,,tibial_traction_pin,,,,
Where should a proximal tibial traction pin be placed?,2 cm distal and 2 cm posterior to the tibial tubercle,,trauma,,leg,proximal_tibia,,,tibial_traction_pin,,,,
What additional injury must be ruled out in a patient with a femoral shaft fracture?,Ipsilateral femoral neck fracture,,trauma,,hip,femoral_neck,femoral_shaft_fx,femoral_neck_fx,,,,,
Femoral neck fractures associated with femoral shaft fractures have what characteristics (3)?,High Pauwel's angle (vertical) Basicervical Nondisplaced,,trauma,,hip,femoral_neck,femoral_shaft_fx,femoral_neck_fx,,,,,
What are the surgical treatment options for patients with ipsilateral femoral neck and shaft fractures?,Retrograde intramedullary nail (IMN) with sliding hip screw or 3 screws,,trauma,,hip,femoral_neck,femoral_shaft_fx,femoral_neck_fx,femoral_shaft_imn,shs,,,
Which fracture receives priority in a patient with a femoral shaft and ipsilateral femoral neck fracture?,Femoral neck,,trauma,,hip,femoral_neck,femoral_shaft_fx,femoral_neck_fx,,,,,
Why does the femoral neck fracture receive priority treatment over the ipsilateral femoral shaft fracture?,Risk of AVN,,trauma,,hip,femoral_neck,femoral_shaft_fx,femoral_neck_fx,,,,,
What four imaging modalities should be performed to rule out an ipsilateral femoral neck fracture in a patient with a femoral shaft fracture?,AP internal rotation x-ray CT scan Intraoperative lateral fluoroscopy prior to fixation Postoperative AP and lateral x-rays,,trauma,,hip,femoral_neck,femoral_shaft_fx,femoral_neck_fx,,,,,
What are the two most common starting points for an antegrade IMN?,Trochanteric and Piriformis fossa,,trauma,,thigh,femoral_shaft,femoral_shaft_fx,,femoral_shaft_imn,,,,
What is the benefit of using a piriformis IMN instead of trochanteric IMN?,Starting point is in line with the femoral shaft,,trauma,,thigh,femoral_shaft,femoral_shaft_fx,,femoral_shaft_imn,,,,
In which patients is it more difficult to use a piriformis IMN?,Obese patients,,trauma,,thigh,femoral_shaft,femoral_shaft_fx,,femoral_shaft_imn,,,,
What are indications (5) for use of a retrograde IMN?,Obesity Bilateral femur fractures Floating knee Distal femoral shaft fracture Ipsilateral femoral neck or acetabular fracture,,trauma,,thigh,femoral_shaft,femoral_shaft_fx,,femoral_shaft_imn,,,,
What is the starting point for a retrograde IMN on the AP radiograph?,Center of the intercondylar notch,,trauma,,thigh,femoral_shaft,femoral_shaft_fx,,femoral_shaft_imn,,,,
What is the starting point for a retrograde femoral IMN on the Lateral radiograph?,Anterior edge of Blumensaat's line,,trauma,,thigh,femoral_shaft,femoral_shaft_fx,,femoral_shaft_imn,,,,
What structure is at risk with a retrograde IM nail starting point that is posterior to Blumensaat's line?,ACL,,trauma,,knee,femoral_shaft,femoral_shaft_fx,,femoral_shaft_imn,,,,
What structures are at risk with the proximal AP screw in a retrograde femoral IMN?,Femoral nerve and artery,,trauma,,thigh,femoral_shaft,femoral_shaft_fx,,femoral_shaft_imn,,,,
What deformity commonly occurs with distal femur fractures?,Varus and extension,,trauma,,thigh,distal_femur,distal_femur_fx,,,,,,
What are the deforming forces that lead to the varus and extension deformity in the setting of a distal femur fracture?,Extension - Gastrocnemius Varus - Adductor magnus,,trauma,,thigh,distal_femur,distal_femur_fx,,,,,,
What is the name of a distal femur fracture that occurs in the coronal plane?,Hoffa fracture,,trauma,,thigh,distal_femur,distal_femur_fx,,,,,,
What percentage of distal femur fractures have a Hoffa fracture?,38%,,trauma,,thigh,distal_femur,distal_femur_fx,,,,,,
Are Hoffa fractures more common medial or lateral?,Lateral,,trauma,,thigh,distal_femur,distal_femur_fx,,,,,,
With ORIF of the distal femur what deformity may occur if a lateral femoral plate is placed too posteriorly?,Medialization of the articular block,"""Referred to as a """"golf club"""" or """"hockey stock"""" deformity""",trauma,,thigh,distal_femur,distal_femur_fx,,distal_femur_orif,,,,
What additional treatment option is available for patients with a non-reconstructable distal femur fracture?,Distal femoral repalcement,,trauma,,thigh,distal_femur,distal_femur_fx,,dfr,,,,
What is the most sensitive test for diagnosing carpal tunnel syndrome?,Durkan's compression test,,hand,,wrist,carpal_tunnel,carpal_tunnel_syndrome,,,,,,
How do you perform Durkan's compression test?,Hold pressure over carpal tunnel for 30 seconds,Pain or paresthesia indicate a positive test,hand,,wrist,carpal_tunnel,carpal_tunnel_syndrome,,,,,,
What are the two ways in which a carpal tunnel release can be performed?,Open or endoscopic,,hand,,wrist,carpal_tunnel,carpal_tunnel_syndrome,,carpal_tunnel_release,,,,
Which structure may be injured if the transverse carpal ligament is incised too radially?,Recurrent motor branch of the median nerve,,hand,,wrist,carpal_tunnel,carpal_tunnel_syndrome,,,,,,
Which muscles demonstrate atrophy with long standing carpal tunnel syndrome?,Thenar muscles,Flexor pollicis brevis Opponens pollicis Abductor pollicis brevis,hand,,wrist,carpal_tunnel,carpal_tunnel_syndrome,,,,,,
What is the most common reason for failed endoscopic carpal tunnel surgery?,Incomplete release of the transverse carpal ligament distally,,hand,,wrist,carpal_tunnel,carpal_tunnel_syndrome,,carpal_tunnel_release,,,,
Is there any difference in outcomes following open vs endoscopic carpal tunnel release?,Patients with endoscopic surgery return to work earlier No difference in long-term patient outcomes,,hand,,wrist,carpal_tunnel,carpal_tunnel_syndrome,,carpal_tunnel_release,,,,
"Following scapholunate ligament disruption, which part of the ligamentous complex must be repaired?",Dorsal interosseous ligaments,,hand,,hand,,scapholunate_lig_injury,,,,,,
What is unique about the blood supply of the scaphoid?,Retrograde,,hand,,hand,carpals,,,,,,,
How does retrograde blood supply to the scaphoid influence healing?,More proximal injuries = higher rate of AVN,,hand,,hand,carpals,,,,,,,
What physical exam findings (2) are suspicious for a scaphoid fracture?,Anatomic snuffbox tenderness Tenderness of the volar tuberosity,,hand,,hand,carpals,scaphoid_fx,,,,,,
What is a humpback deformity?,Apex dorsal deformity of a scaphoid fracture,,hand,,hand,carpals,scaphoid_fx,,,,,,
What approach to the scaphoid fracture used for proximal pole fractures?,Dorsal,,hand,,hand,carpals,scaphoid_fx,,,,,,
What approach to the scaphoid is most commonly used for distal pole fractures and those with humpback deformities?,Volar,,hand,,hand,carpals,scaphoid_fx,,,,,,
What is a SNAC wrist?,Scaphoid Nonunion Advanced Collapse,,hand,,wrist,carpals,snac_wrist,,,,,,
What are the radiographic stages of a SNAC wrist?,Stage I: Arthritis of scaphoid and radial styloid Stage II: Stage I + scaphocapitate arthritis Stage III: Panscaphoid arthritis,,hand,,wrist,carpals,snac_wrist,,,,,,
What is a SLAC wrist?,ScaphoLunate Advanced Collapse,,hand,,wrist,carpals,slac_wrist,,,,,,
What is the SLAC wrist classification?,Watson Classification,Stage I: Arthritis of scaphoid and radial styloid Stage II: Stage I + scaphoid facet arthritis Stage III: Stage II + capitolunate arthritis,hand,,wrist,carpals,slac_wrist,,,,,,
Which joint is commonly spared in a SLAC wrist?,Radiolunate,,hand,,wrist,carpals,slac_wrist,,,,,,
What deformity results from chronic scapholunate ligament injury?,Coupled motion between the scaphoid and lunate is lost,The intact lunotriquetral ligament causes lunate extension,hand,,hand,carpals,scapholunate_lig_injury,,,,,,
What does the Watson test evaluate?,Scapholunate instability,,hand,,hand,carpals,scapholunate_lig_injury,,,,,,
How is the Watson test performed?,Volar pressure over the distal scaphoid while the wrist is taken from ulnar to radial deviation,"""A """"clunk"""" indicates instability""",hand,,wrist,carpals,,,,,,,
What is the eponym for atraumatic AVN of the scaphoid?,Preiser's disease,,hand,,hand,carpals,scaphoid_avn,,,,,,
What is the classification for perilunate injuries?,Mayfield Classification,Stage I: Scapholunate dissociation Stage II: Stage I + Lunocapitate disruption Stage III: Stage II + Lunotriquetral disruption Stage IV: Lunate dislocation,hand,,hand,carpals,perilunate_injury,,,,,,
What is the difference between lunate and perilunate dislocations?,Lunate dislocation: The lunate is dislocated from the intact carpus   Perilunate dislocation: The carpus dislocates while the lunate stays in its anatomic position,,hand,,hand,carpals,perilunate_injury,lunate_dislocation,,,,,
What deformity results from chronic lunotriquetral ligament injury?,VISI - Volar Intercalated Segment Instability,,hand,,hand,carpals,lunotriquetral_lig_injury,,,,,,
Why does VISI occur following a lunotriquetral ligament injury?,Coupled motion between the triquetrum and lunate is lost,The intact scapholunate ligament causes lunate flexion,hand,,hand,carpals,lunotriquetral_lig_injury,,,,,,
What is the eponym for the AVN of the lunate?,Kienbock's disease,,hand,,hand,carpals,kienbock_disease,,,,,,
What is the classification for Kienbock's disease?,Lichtman Classification,Stage I: No changes on x-ray Stage II: Sclerosis of the lunate on x-ray Stage III: Lunate collapse -A: Without scaphoid rotation -B: With scaphoid rotation Stage IV: Degeneration of adjacent joints,hand,,hand,carpals,kienbock_disease,,,,,,
What associated injury must be evaluated with a metacarpal base fracture?,Carpometacarpal (CMC) joint dislocation,,hand,,hand,metacarpals,metacarpal_base_fx,,,,,,
What are the acceptable non-operative tolerances for metacarpal shaft fractures?,Index and long fingers: 20Â° of angulation Ring finger: 30Â° of angulation Small finger: 40Â° of angulation,,hand,,hand,metacarpals,metacarpal_shaft_fx,,,,,,
How much shortening and rotation may be accepted with a metacarpal shaft fracture?,Shortening: 2-5 mm Rotation: none,,hand,,hand,metacarpals,metacarpal_shaft_fx,,,,,,
What are the acceptable nonoperative tolerances for metacarpal neck fractures?,Index and long fingers: 15Â° of angulation Ring finger: 40Â° of angulation Small finger: 60Â° of angulation,,hand,,hand,metacarpals,metacarpal_neck_fx,,,,,,
Hyperextension of the MCPJ may lead to avulsion of what structure?,Volar plate,,hand,,hand,metacarpals,mcpj_injury,,,,,,
Why is traction avoided during the reduction of an MCPJ dislocation?,May lead to interposition of the volar plate creating an irreducible dislocation,,hand,,hand,metacarpals,mcpj_dislocation,,,,,,
In what position should the hand be splinted following a metacarpal fracture?,Intrinsic plus position,Intrinsic plus position: Slight wrist extension with MCP joint flexion and IP joint extension,hand,,hand,metacarpals,metacarpal_fx,,,,,,
Why is the intrinsic plus position recommended for metacarpal fractures?,Keeps tension on the collateral ligaments to help prevent stiffness,,hand,,hand,metacarpals,metacarpal_fx,,,,,,
What is the eponym for a fifth metacarpal neck fracture?,Boxer's fracture,,hand,,hand,metacarpals,metacarpal_neck_fx,,,,,,
What is the eponym for a fifth metacarpal base fracture?,Baby Bennett,,hand,,hand,metacarpals,metacarpal_base_fx,,,,,,
What is the eponym for a simple intra-articular first metacarpal base fracture?,Bennett fracture,*Deforming forces on Bennett fracture: Supination-adduction displacement from the adductor pollicis (ulnar nerve) and dorsal-radial displacement from the abductor pollicis longus and extensory pollicis brevis (both PIN)  *Small fragment on ulnar side maintains its connection to the trapezium by the anterior oblique ligament (AKA volar beak ligament),hand,,hand,metacarpals,metacarpal_base_fx,,,,,,stopped
What is the eponym for an intra-articular first metacarpal base fracture with multiple fracture lines?,Rolando fracture,,hand,,hand,metacarpals,metacarpal_base_fx,,,,,,
What are the primary deforming forces (2) to a fracture at the base of the first metacarpal?,Abductor pollicis longus (APL) pulling the shaft proximally and dorsally   Adductor pollicis pulling the distal metacarpal shaft ulnar,,hand,,hand,metacarpals,metacarpal_base_fx,,,,,,
What ligament allows the volar-ulnar fracture fragment to stay reduced in a thumb metacarpal base fracture?,Volar beak ligament,,hand,,hand,metacarpals,metacarpal_base_fx,,,,,,
What are the eponyms (2) for a thumb ulnar collateral ligament (UCL) injury?,Gamekeeper's thumb Skier's thumb,*UCL laxity in flexion only = isolated injury to the proper UCL; accessory UCL is intact,hand,,hand,,ucl_injury_thumb,,,,,,
What is a Stener lesion?,Adductor pollicis aponeurosis becomes interposed between the avulsed UCL and the thumb,,hand,,hand,,ucl_injury_thumb,,,,,,
Why are Stener lesions important to recognize?,They're unlikely to heal without surgery,Orthobullets: Stener Lesion: avulsed ligament with or without bony attachment is displaced dorsal and superficial to the adductor aponeurosis,hand,,hand,,ucl_injury_thumb,,,,,,
"When evaluating thumb UCL injuries, what ligaments (2) are being assessed with the thumb in full extension?",Accessory and proper UCL ligaments,,hand,,hand,,ucl_injury_thumb,,,,,,
"When evaluating thumb UCL injuries, what ligament is being assessed with the thumb in 30Â° of flexion?",Proper UCL ligament only,,hand,,hand,,ucl_injury_thumb,,,,,,
What ligament is torn with a thumb CMC joint dislocation?,Dorsoradial ligament,*Dorsal dislocations = more common than volar,hand,,hand,,cmcj_dislocation,,,,,,
